{
  "pack_id": "ma-y3-number-recall-3-4-8-tables",
  "version": "0.1.0",
  "status": "review",
  "source_alignment": {
    "jurisdiction": "England",
    "key_stage": 2,
    "year": 3,
    "subject": "Mathematics",
    "strand": "Multiplication and division",
    "topic": "Recall 3, 4 and 8 multiplication tables",
    "source_ids": ["govuk-mathematics-programmes-ks1-4"],
    "source_statement": "Recall and use multiplication and division facts for the 3, 4 and 8 multiplication tables.",
    "derived_objective_note": "This pack builds fluency from equal groups, arrays and doubling relationships before timed recall."
  },
  "objective": {
    "id": "ma-y3-number-recall-3-4-8-tables",
    "child_goal": "I can recall and explain 3, 4 and 8 times table facts.",
    "statement": "Recall and use 3, 4 and 8 multiplication and division facts with representations and related-fact reasoning.",
    "prerequisites": ["ma-y2-count-in-2-5-10", "ma-y3-arrays-equal-groups", "ma-y3-number-doubling-halving"],
    "misconceptions": [
      "Counts from the beginning for every fact instead of using known related facts.",
      "Confuses 4x and 8x facts without seeing that 8x is double 4x.",
      "Does not connect division facts to multiplication facts."
    ],
    "vocabulary": [
      { "term": "factor", "child_explanation": "A number in a multiplication fact.", "audio_script": "The factors are the numbers being multiplied.", "visual_anchor": "Two factor tiles feeding an array." },
      { "term": "product", "child_explanation": "The answer to a multiplication fact.", "audio_script": "The product is the answer when we multiply.", "visual_anchor": "The total cells in an array." },
      { "term": "related fact", "child_explanation": "A fact that helps you know another fact.", "audio_script": "If you know four eights, you can double it to know eight eights.", "visual_anchor": "A bridge between two fact cards." }
    ],
    "mastery": {
      "expected": 80,
      "secure": 90,
      "retention_days": [1, 3, 7, 14, 30],
      "required_formats": ["array-build", "fact-family", "timed-recall"]
    }
  },
  "teaching_sequence": [
    {
      "step_id": "equal-groups-warm-up",
      "kind": "warm_up",
      "child_prompt": "Build 4 groups of 3 counters.",
      "learning_purpose": "Check equal-group meaning before recall.",
      "audio_script": "Multiplication means equal groups.",
      "visual_model": "Explorer crates fill with equal counters.",
      "animation_hook": "equal-groups-fill",
      "estimated_seconds": 45
    },
    {
      "step_id": "fact-bridge-launch",
      "kind": "concept_launch",
      "child_prompt": "Use fact bridges to travel from 4x facts to 8x facts.",
      "learning_purpose": "Introduce related-fact strategies for fluency.",
      "audio_script": "Eight groups are double four groups.",
      "visual_model": "A bridge doubles an array from 4 rows to 8 rows.",
      "animation_hook": "array-double-bridge",
      "estimated_seconds": 55
    },
    {
      "step_id": "worked-4x8-8x8",
      "kind": "worked_example",
      "child_prompt": "4 x 8 is 32, so 8 x 8 is double 32.",
      "learning_purpose": "Model using known facts rather than counting from one.",
      "audio_script": "Double thirty-two to get sixty-four.",
      "visual_model": "A 4 by 8 array copies itself underneath.",
      "animation_hook": "array-copy-double",
      "estimated_seconds": 60
    },
    {
      "step_id": "guided-fact-family",
      "kind": "guided_practice",
      "child_prompt": "Match 6 x 4, 4 x 6, 24 divided by 4 and 24 divided by 6.",
      "learning_purpose": "Connect multiplication and division facts.",
      "audio_script": "One array can show two multiplication and two division facts.",
      "visual_model": "Fact-family cards orbit one array.",
      "animation_hook": "fact-family-orbit",
      "estimated_seconds": 75
    },
    {
      "step_id": "mixed-recall-checkpoint",
      "kind": "checkpoint",
      "child_prompt": "Answer 7 x 8 and show the fact that helped.",
      "learning_purpose": "Check recall with reasoning support.",
      "audio_script": "Use a known fact if you need one.",
      "visual_model": "A recall gate with optional array reveal.",
      "animation_hook": "recall-gate-open",
      "estimated_seconds": 45
    },
    {
      "step_id": "teach-companion-facts",
      "kind": "teach_back",
      "child_prompt": "Teach Rafi why knowing 4 x 7 helps with 8 x 7.",
      "learning_purpose": "Use teach-back to secure doubling relationships.",
      "audio_script": "Can you show me the double?",
      "visual_model": "The companion holds one 4x array and asks for 8x.",
      "animation_hook": "companion-double-fact",
      "estimated_seconds": 45
    }
  ],
  "manipulatives": [
    {
      "id": "fact-bridge-array-builder",
      "type": "array-build",
      "purpose": "Connect equal groups, arrays, related facts and division fact families.",
      "interaction_notes": "Learners build arrays, double 4x to 8x, match fact families and then move into low-pressure timed recall.",
      "accessibility_notes": "Reduced-motion mode uses static array copies; audio prompts read each fact aloud."
    },
    {
      "id": "fact-family-bridge-locks",
      "type": "fact-family",
      "purpose": "Strengthen recall by linking each multiplication fact to its commutative partner and related division facts.",
      "interaction_notes": "Learners choose four fact keys to open a bridge lock, reject a near-miss key and use a 3, 4 or 8 times-table relationship to explain why the family belongs together.",
      "accessibility_notes": "Keyboard selection and numbered shortcuts place fact keys; single-switch scanning offers each key, check and undo without a timer; static mode shows the lock as four labelled answer slots; reduced-motion mode replaces key turns and bridge movement with immediate ticks, spoken feedback and a text fact-family summary."
    }
  ],
  "practice": {
    "formats": ["array-build", "fact-family", "timed-recall"],
    "variant_targets": { "pilot": 240, "release": 620, "mature": 1500, "deep": 2500 },
    "difficulty_bands": ["intro", "developing", "expected", "secure", "stretch"],
    "interleaving_notes": "Interleave 3, 4 and 8 facts after individual table patterns are stable."
  },
  "variant_blueprints": [
    { "id": "equal-group-array-builds", "format": "array-build", "count": 300, "difficulty_band": "intro", "purpose": "Build 3, 4 and 8 facts from equal groups and arrays.", "generation_pattern": "factor pair + array grid + build target", "review_notes": "Keep early tasks untimed.", "source": "template_generated" },
    { "id": "double-four-to-eight", "format": "array-build", "count": 280, "difficulty_band": "developing", "misconception_tag": "confuses_4x_8x", "purpose": "Use doubling to connect 4x and 8x facts.", "generation_pattern": "4x known fact + double prompt + 8x target", "review_notes": "Show value conservation during doubling.", "source": "template_generated" },
    { "id": "multiplication-division-families", "format": "fact-family", "count": 320, "difficulty_band": "expected", "misconception_tag": "division_not_connected", "purpose": "Connect multiplication and division facts for the same array.", "generation_pattern": "array + four fact cards + missing card", "review_notes": "Use division language alongside sharing/grouping visuals.", "source": "template_generated" },
    { "id": "mixed-low-pressure-recall", "format": "timed-recall", "count": 360, "difficulty_band": "secure", "purpose": "Build fluent mixed recall without over-rewarding speed before understanding.", "generation_pattern": "mixed 3/4/8 fact + optional strategy reveal + response window", "review_notes": "Respect low-sensory and no-timer settings.", "source": "template_generated" },
    { "id": "fact-retrieval-spaced", "format": "timed-recall", "count": 240, "difficulty_band": "retrieval", "purpose": "Provide spaced retrieval across multiplication and division facts.", "generation_pattern": "review queue + known weakness + fact family rotation", "review_notes": "Avoid streak pressure.", "source": "template_generated" }
  ],
  "question_variants": [
    {
      "id": "ma-y3-number-recall-3-4-8-tables-q-double-4x7",
      "format": "array-build",
      "body": { "prompt": "Use 4 x 7 = 28 to find 8 x 7.", "known_fact": "4 x 7 = 28", "choices": [35, 56, 64, 48] },
      "expected_answer": { "value": 56 },
      "hints": ["8 groups is double 4 groups.", "Double 28."],
      "explanation": "8 x 7 is double 4 x 7, so double 28 is 56.",
      "difficulty": 5,
      "status": "approved",
      "misconception_tag": "confuses_4x_8x",
      "animation_hook": "array-copy-double"
    },
    {
      "id": "ma-y3-number-recall-3-4-8-tables-q-fact-family",
      "format": "fact-family",
      "body": { "prompt": "Which division fact belongs with 6 x 4 = 24?", "choices": ["24 / 4 = 6", "24 / 6 = 5", "6 / 4 = 24", "4 / 24 = 6"] },
      "expected_answer": { "value": "24 / 4 = 6" },
      "hints": ["Use the same total: 24.", "How many groups of 4 are in 24?"],
      "explanation": "24 / 4 = 6 belongs to the same fact family as 6 x 4 = 24.",
      "difficulty": 5,
      "status": "approved",
      "misconception_tag": "division_not_connected",
      "animation_hook": "fact-family-orbit"
    },
    {
      "id": "ma-y3-number-recall-3-4-8-tables-q-7x8",
      "format": "timed-recall",
      "body": { "prompt": "What is 7 x 8?", "choices": [48, 54, 56, 64] },
      "expected_answer": { "value": 56 },
      "hints": ["5 x 8 is 40.", "Add 2 more groups of 8."],
      "explanation": "7 x 8 is 56.",
      "difficulty": 6,
      "status": "approved",
      "misconception_tag": "counts_from_start",
      "animation_hook": "recall-gate-open"
    }
  ],
  "misconception_repairs": [
    {
      "misconception": "Counts from the beginning for every fact instead of using known related facts.",